{
  "$schema":"https://json-schema.org/draft/2020-12/schema",
  "$id":"https://open-llm-learner.local/schemas/mod.schema.json",
  "title":"Open LLM Learner MOD manifest",
  "type":"object",
  "required":["format","format_version","id","version","protocol","entry","provides"],
  "properties":{
    "format":{"const":"open-llm-learner.mod"},
    "format_version":{"const":1},
    "id":{"type":"string","minLength":1},
    "name":{"type":"string"},
    "description":{"type":"string"},
    "version":{"type":"string","minLength":1},
    "protocol":{"type":"string","minLength":1},
    "entry":{
      "type":"object",
      "required":["command"],
      "properties":{
        "command":{"type":"string","minLength":1},
        "args":{"type":"array","items":{"type":"string"}}
      },
      "additionalProperties":false
    },
    "concurrency":{"enum":["serial","parallel"],"default":"serial"},
    "permissions":{"type":"array","items":{"type":"string"},"uniqueItems":true},
    "provides":{
      "type":"object",
      "additionalProperties":{
        "type":"object",
        "properties":{
          "capability":{"type":"string"},
          "input_schema":{"type":"string"},
          "output_schema":{"type":"string"},
          "title":{"type":"string"},
          "description":{"type":"string"}
        },
        "additionalProperties":false
      }
    },
    "dependencies":{
      "type":"array",
      "items":{
        "type":"object",
        "required":["id","version"],
        "properties":{
          "id":{"type":"string"},
          "version":{"type":"string"}
        },
        "additionalProperties":false
      }
    }
  },
  "additionalProperties":false
}
