{
  "format": "open-llm-learner.mod",
  "format_version": 1,
  "id": "official.text",
  "name": "Official Text Read Reference MOD",
  "version": "0.1.0",
  "protocol": "1.0",
  "entry": {
    "command": "oll-mod-text"
  },
  "concurrency": "parallel",
  "permissions": [
    "host.filesystem.read"
  ],
  "provides": {
    "read_text": {
      "capability": "reference.text.read",
      "description": "Read a text file from the host after the Project grants host.filesystem.read."
    }
  }
}
